{
  "schemaVersion": "1.0",
  "packId": "runtime-retail",
  "title": "Connected Retail Estate",
  "industry": "Retail stores",
  "subtitle": "Refrigeration + energy + maintenance → protect stock and service economics",
  "status": "synthetic-simulation",
  "enterprisePackRef": {
    "packId": "retail",
    "nodeIds": [
      "b3",
      "f4",
      "s2",
      "h2",
      "k2"
    ]
  },
  "valueIntent": {
    "objective": "Protect availability, stock integrity and store profitability",
    "accountableOwner": "Retail Operations Director",
    "metric": "Cold-chain compliance / £ spoilage exposure",
    "baseline": "Temperature control policy; no verified avoided-loss baseline",
    "target": "Restore policy-compliant temperature safely",
    "benefitHypothesis": "Exposure avoided is not savings; requires actual spoiled-stock and downtime evidence",
    "riskBoundary": "Food safety, brand reputation and regulatory reporting",
    "approvalAuthority": "Store and food-safety owner approval",
    "autonomy": "L1 recommendation / L2 ticket with approval",
    "valueStatus": "unvalidated"
  },
  "agents": [
    {
      "id": "sense",
      "name": "Signal Steward",
      "type": "Deterministic ingestion",
      "mandate": "Normalise source events, provenance, freshness and completeness",
      "icon": "◉",
      "tone": "blue"
    },
    {
      "id": "context",
      "name": "Context & Graph",
      "type": "Hybrid reasoning",
      "mandate": "Resolve assets, zones, owners, policy context and source conflicts",
      "icon": "⌘",
      "tone": "cyan"
    },
    {
      "id": "value",
      "name": "Value Reasoner",
      "type": "Bounded hypothesis reasoning",
      "mandate": "Evaluate materiality, counterfactuals, benefit ownership and confidence",
      "icon": "◇",
      "tone": "violet"
    },
    {
      "id": "plan",
      "name": "Intervention Planner",
      "type": "AI-assisted planning",
      "mandate": "Form choices with expected impact, dependencies and failure modes",
      "icon": "▤",
      "tone": "amber"
    },
    {
      "id": "guard",
      "name": "Policy & Risk Gate",
      "type": "Deterministic policy enforcement",
      "mandate": "Enforce role permissions, OT safety, privacy, human approval",
      "icon": "⬡",
      "tone": "red"
    },
    {
      "id": "act",
      "name": "Action Broker",
      "type": "Permissioned workflow adapter",
      "mandate": "Issue authorised tickets and controlled commands; handle receipts and rollback",
      "icon": "↗",
      "tone": "blue"
    },
    {
      "id": "verify",
      "name": "Outcome Auditor",
      "type": "Independent measurement",
      "mandate": "Compare before/after, control for confounders, sign benefits and improve graph",
      "icon": "✓",
      "tone": "green"
    }
  ],
  "connectors": [
    "Refrigeration controller / BMS",
    "Energy submeters",
    "Maintenance CMMS",
    "Store operations records"
  ],
  "permissions": [
    "Read refrigeration alarm data",
    "Cross-reference energy and CMMS",
    "Create an authorised priority ticket",
    "No refrigeration setpoint or safety override"
  ],
  "signalSnapshot": [
    {
      "source": "BMS",
      "name": "Case temperature anomaly",
      "value": "7.8°C",
      "quality": "simulated"
    },
    {
      "source": "Energy meter",
      "name": "Compressor load",
      "value": "+24%",
      "quality": "simulated"
    },
    {
      "source": "CMMS",
      "name": "Prior related incidents",
      "value": "3",
      "quality": "simulated"
    }
  ],
  "stakeholders": [
    "COO / Retail",
    "Store Director",
    "Facilities",
    "Loss Prevention",
    "Finance"
  ],
  "valueStreams": "Mitigate risk · Save money · Protect revenue",
  "partnerRole": "Retail FM, refrigeration OEM and service partner",
  "ciscoRole": "Secure connectivity, estate observability, Spaces only where relevant",
  "scene": "retail",
  "dataLabels": [
    "Refrigeration BMS",
    "Energy meter",
    "CMMS history",
    "Store duty rota"
  ],
  "workflow": [
    {
      "id": "0",
      "name": "Observe",
      "agent": "sense",
      "contract": "Event stream",
      "description": "New source events arrive and are quality checked.",
      "detail": "A sustained temperature excursion coincides with elevated compressor demand and previous service issues.",
      "requiresApproval": false,
      "evidenceState": "observed"
    },
    {
      "id": "1",
      "name": "Contextualise",
      "agent": "context",
      "contract": "Knowledge graph",
      "description": "Join physical, operational and business context.",
      "detail": "A sustained temperature excursion coincides with elevated compressor demand and previous service issues.",
      "requiresApproval": false,
      "evidenceState": "observed"
    },
    {
      "id": "2",
      "name": "Hypothesise",
      "agent": "value",
      "contract": "Value intent",
      "description": "Estimate significance without asserting causation.",
      "detail": "An early inspection may reduce spoilage exposure and unnecessary energy consumption.",
      "requiresApproval": false,
      "evidenceState": "proposed"
    },
    {
      "id": "3",
      "name": "Plan",
      "agent": "plan",
      "contract": "Options",
      "description": "Compare interventions, cost, confidence and risk.",
      "detail": "Raise a priority investigation with temperature evidence and duty manager escalation; do not remotely override refrigeration safety limits.",
      "requiresApproval": false,
      "evidenceState": "proposed"
    },
    {
      "id": "4",
      "name": "Guard",
      "agent": "guard",
      "contract": "Policy verdict",
      "description": "Apply the delegated authority and safety boundaries.",
      "detail": "Food safety dominates energy optimisation. Store manager and FM escalation; no automatic refrigeration changes.",
      "requiresApproval": false,
      "evidenceState": "proposed"
    },
    {
      "id": "5",
      "name": "Approve",
      "agent": "guard",
      "contract": "Human decision",
      "description": "The accountable human accepts or rejects the proposed action.",
      "detail": "Store and food-safety owner approval",
      "requiresApproval": false,
      "evidenceState": "proposed"
    },
    {
      "id": "6",
      "name": "Act",
      "agent": "act",
      "contract": "Action receipt",
      "description": "Create authorised workflow actions with audit and rollback.",
      "detail": "Create a SIMULATED priority work order and notify store operations; no refrigeration controls are written.",
      "requiresApproval": true,
      "evidenceState": "proposed"
    },
    {
      "id": "7",
      "name": "Verify",
      "agent": "verify",
      "contract": "Evidence ledger",
      "description": "Check pre/post data and counterfactual validity.",
      "detail": "Confirm product disposition by food-safety owner, repair outcome, temperature normalisation and avoided recurrence.",
      "requiresApproval": true,
      "evidenceState": "simulated"
    },
    {
      "id": "8",
      "name": "Learn",
      "agent": "verify",
      "contract": "Updated Value Twin",
      "description": "Publish verified evidence, or record unresolved gaps.",
      "detail": "Create a verified fault-pattern playbook and estimate value only from reviewed loss/energy data.",
      "requiresApproval": true,
      "evidenceState": "simulated"
    }
  ],
  "outcome": {
    "baseline": "Temperature control policy; no verified avoided-loss baseline",
    "target": "Restore policy-compliant temperature safely",
    "metric": "Cold-chain compliance / £ spoilage exposure",
    "benefitHypothesis": "Exposure avoided is not savings; requires actual spoiled-stock and downtime evidence",
    "verification": "Confirm product disposition by food-safety owner, repair outcome, temperature normalisation and avoided recurrence.",
    "certainty": "High-risk scenario; no autonomous control"
  },
  "controls": {
    "requireHumanApproval": true,
    "allowPhysicalControl": false,
    "allowedActions": [
      "Escalation and ticket only"
    ],
    "riskNotes": "Food safety, brand reputation and regulatory reporting"
  },
  "provenance": {
    "sources": "Illustrative operational values; not live Cisco/BMS data",
    "verified": false,
    "generated": "2026-10-09"
  }
}